{
  "schema_version": "1.1",
  "runtime_id": "sovereign-runtime-cuda-x86_64-2026.07.0",
  "runtime_version": "2026.07.0",
  "vllm_version": "0.25.0-lazarus",
  "backend": "cuda",
  "profile": "cuda-x86_64",
  "topology": "single_process_multi_role",
  "state": "healthy",
  "api": {
    "openai_compatible": true,
    "port": 8000,
    "base_path": "/v1"
  },
  "roles": {
    "generation": {
      "enabled": true,
      "status": "healthy",
      "task": "generate",
      "served_model_name": "assistant-large",
      "engine_model": "Qwen/Qwen3-32B-AWQ",
      "revision": "immutable-revision",
      "context_length": 32768
    },
    "embedding": {
      "enabled": true,
      "status": "healthy",
      "task": "embed",
      "served_model_name": "embedding-omni-default",
      "engine_model": "LCO-Embedding/LCO-Embedding-Omni-3B-2605",
      "revision": "immutable-revision",
      "dimensions": 2048,
      "pooling": "last",
      "normalization": "l2",
      "modalities": ["text", "image", "audio"]
    }
  },
  "resource_policy": {
    "enforcement": "best_effort",
    "generation_memory_weight": 82,
    "embedding_memory_weight": 18
  },
  "accelerator": {
    "vendor": "nvidia",
    "device_count": 1,
    "unified_memory": false
  },
  "health": {
    "status": "healthy",
    "driver": "ok",
    "kernels": "ok",
    "metrics": "ok"
  }
}
